{
  "schema_id": "kolibri.command",
  "schema_version": "1.0",
  "message_id": "cmd_01K0GOALUPDATE01",
  "command_name": "goal.update",
  "payload_schema_id": "kolibri.goal.update.command",
  "payload_schema_version": "1.0",
  "issued_at": "2026-07-24T03:01:00+03:00",
  "deadline_at": "2026-07-24T03:02:00+03:00",
  "target_owner": "logical_home_control_plane",
  "identity": {
    "tenant_id": "ten_01K0TENANT00001",
    "user_id": "usr_01K0USER000001",
    "actor": {
      "actor_id": "agent_01K0CONDUCTOR1",
      "actor_type": "agent"
    },
    "authority": {
      "authority_id": "auth_01K0LHCP000001",
      "authority_role": "logical_home_control_plane",
      "authority_epoch": 8,
      "authority_placement_id": "placement_home_01",
      "authorization_decision_id": "decision_01K0GOALAUTH2",
      "capabilities": [
        "goal.update"
      ]
    },
    "subject_refs": {
      "goal_id": "goal_01K0CREATE00001",
      "case_id": null,
      "task_id": null
    }
  },
  "trace": {
    "trace_id": "2123456789abcdef0123456789abcdef",
    "span_id": "3123456789abcdef",
    "parent_span_id": "2123456789abcdef",
    "correlation_id": "corr_01K0GOALCREATE",
    "causation_id": "cmd_01K0GOALCREATE01"
  },
  "idempotency": {
    "key": "goal.update:01K0GOALUPDATE",
    "scope": "goal",
    "scope_id": "goal_01K0CREATE00001",
    "canonical_request_hash": "sha256:5303228ba5b31ecb2047c0576790b33b2113d454f7470fd6caf6500af484dd22"
  },
  "payload": {
    "schema_id": "kolibri.goal.update.command",
    "schema_version": "1.0",
    "goal_id": "goal_01K0CREATE00001",
    "expected_version": 1,
    "next_version": 2,
    "goal": {
      "schema_id": "kolibri.goal",
      "schema_version": "1.0",
      "goal_id": "goal_01K0CREATE00001",
      "tenant_id": "ten_01K0TENANT00001",
      "user_id": "usr_01K0USER000001",
      "intent": {
        "source_message_id": "message_01K0MESSAGE01",
        "original_request": "Составь смету на ремонт квартиры площадью 80 м².",
        "normalized_objective": "Подготовить проверяемую смету ремонта квартиры площадью 80 м².",
        "locale": "ru-RU"
      },
      "acceptance_criteria": [
        {
          "criterion_id": "criterion_01K0TOTAL001",
          "statement": "Смета содержит объёмы, цены и итог.",
          "verification_method": "Проверка структуры и арифметики.",
          "required": true,
          "status": "pending"
        }
      ],
      "budget_policy": {
        "currency": "RUB",
        "compute_units_limit": 50000,
        "tool_calls_limit": 200,
        "external_spend_limit_minor": 0,
        "human_services_limit_minor": 0,
        "approval_required_above_minor": 0
      },
      "deadline_policy": {
        "due_at": null,
        "timezone": "Europe/Moscow",
        "late_action": "continue_and_flag"
      },
      "status": "new",
      "blocking_question_ids": [],
      "case_id": null,
      "current_case_version": null,
      "workflow_id": null,
      "current_workflow_version": null,
      "version": 2,
      "supersedes_goal_id": null,
      "created_at": "2026-07-24T03:00:00+03:00",
      "updated_at": "2026-07-24T03:01:00+03:00"
    },
    "reason": "Пользователь уточнил площадь объекта.",
    "requested_at": "2026-07-24T03:01:00+03:00"
  }
}
